<?xml version="1.0" encoding="UTF-8"?>
<xs:schema version="1.0" xmlns:xs="http://www.w3.org/2001/XMLSchema">
    <xs:element name="questions">
        <xs:complexType>
            <xs:sequence>
                <xs:element name="question" maxOccurs="unbounded" minOccurs="1">
                    <xs:complexType>
                        <xs:sequence>
                            <xs:element type="xs:string" name="type"/>
                            <xs:element type="xs:string" name="title"/>
                            <xs:element type="xs:string" name="option" maxOccurs="unbounded" minOccurs="0"/>
                            <xs:element type="xs:string" name="answer" maxOccurs="unbounded" minOccurs="1"/>
                        </xs:sequence>
                        <xs:attribute type="xs:integer" name="id" use="required"/>
                    </xs:complexType>
                </xs:element>
            </xs:sequence>
        </xs:complexType>
    </xs:element>
</xs:schema>
